[
  {
    "journal": "Science (AAAS)",
    "article_type": "Research Article (standard)",
    "title_limit": "96 characters (including spaces)",
    "abstract_limit": "125 words or less",
    "word_limit": "3,000 words for the main text (standard Research Article)",
    "figure_limit": "3–5 display items (figures or tables) with brief legends",
    "reference_limit": "About 50 main‑text references",
    "structure": "Main text should be divided into sections with brief descriptive subheadings. Materials and Methods should be included in the supplementary materials and must provide sufficient detail to allow replication of the study. All data must be available in the main text, supplementary materials or a public repository and cited appropriately.",
    "other_requirements": "Research Articles not suitable for the print format (often those with more than four figures) will still appear online, with a one‑page summary (~500 words divided into Introduction, Rationale, Results and Conclusion) and a summary figure in the print version. The methods run after the main text, while additional data and figures remain in the supplementary materials. Authors should follow the general manuscript preparation guidelines (docx template, single spacing, figure preparation rules, etc.).",
    "last_accessed": "2025-07-26"
  },
  {
    "journal": "Science (AAAS)",
    "article_type": "Research Article (extended online)",
    "title_limit": "96 characters (including spaces)",
    "abstract_limit": "125 words or less",
    "word_limit": "Up to 6,000 words for the main text",
    "figure_limit": "Up to 6 display items (figures, tables or videos)",
    "reference_limit": "Up to 100 main‑text references; for meta‑analyses requiring more than 250 total references, authors should contact the editors before submission",
    "structure": "Same as standard Research Articles: main text divided into brief subheadings, methods section follows the main text, additional information in supplementary materials. A cover letter should explain why an extended format is merited.",
    "other_requirements": "Only a few Research Articles are granted the extended online format; authors must justify the need for additional length in the cover letter. Data availability and supplementary materials requirements remain the same.",
    "last_accessed": "2025-07-26"
  },
  {
    "journal": "Science (AAAS)",
    "article_type": "Review",
    "title_limit": "Not specified (should be concise)",
    "abstract_limit": "Enhanced abstract of 500 words divided into ‘Background’, ‘Advances’ and ‘Outlook’, plus a summary figure (print version)",
    "word_limit": "Up to 5,500 words for the main text",
    "figure_limit": "4–6 display items (figures, boxes or tables)",
    "reference_limit": "Up to 150 references (with fewer than 20% referring to the authors’ own work)",
    "structure": "Reviews are authoritative syntheses of fields that have advanced over the past 3–5 years. They should not include unpublished data. Most Reviews are published online only; a summary appears in print.",
    "other_requirements": "Authorship is ideally 1–3 authors (no more than 7). Schematic figures should be created by the authors and not reproduced from elsewhere. Unsolicited review offers are considered. Reviews in special issues may have shorter lengths at the editors’ discretion.",
    "last_accessed": "2025-07-26"
  },
  {
    "journal": "Science (AAAS)",
    "article_type": "Analytical Review",
    "title_limit": "Not specified (should be concise)",
    "abstract_limit": "Enhanced abstract of 550–600 words divided into ‘Background’, ‘Advances’ and ‘Outlook’, plus a summary figure",
    "word_limit": "Up to 6,000 words for the main text",
    "figure_limit": "4–6 display items (figures, boxes or tables)",
    "reference_limit": "Up to 150 references (no more than 20% referring to the authors’ own work)",
    "structure": "Analytical Reviews provide original analyses of published research from the past 3–5 years (no new data). They follow a similar structure to Reviews but may include original analysis of published data (formal meta‑analyses are considered original research).",
    "other_requirements": "Typically 1–3 authors (maximum 7). Schematic figures should be produced by authors. Enhanced abstract with 550–600 words and summary figure for print.",
    "last_accessed": "2025-07-26"
  },
  {
    "journal": "Science (AAAS)",
    "article_type": "Policy Article",
    "title_limit": "Not specified",
    "abstract_limit": "Not specified",
    "word_limit": "2,000–3,000 words",
    "figure_limit": "1–2 figures",
    "reference_limit": "Up to 15 references",
    "structure": "Policy Articles present new, unpublished data and analyses that explore issues at the interface between science and society with policy implications.",
    "other_requirements": "Authors should follow standard submission guidelines; data must be available, and the article should draw upon existing work while presenting original analyses.",
    "last_accessed": "2025-07-26"
  },
  {
    "journal": "Science (AAAS)",
    "article_type": "Perspective (linked to Science paper)",
    "title_limit": "Not specified",
    "abstract_limit": "Not required",
    "word_limit": "Approximately 1,000 words for Perspectives that comment on papers in the same issue; stand‑alone Perspectives are about 1,800 words",
    "figure_limit": "1 figure (stand‑alone Perspectives may include 1 table instead)",
    "reference_limit": "15 references",
    "structure": "Perspectives highlight recent and exciting research or emerging themes, adding context and interpretation. They should add a new dimension to the research and not simply describe what was done.",
    "other_requirements": "Linked Perspectives typically have no more than two authors. Stand‑alone Perspectives are invited or may be proposed and can be opinionated or historical. All data must be available as per Science’s policies.",
    "last_accessed": "2025-07-26"
  },
  {
    "journal": "Science (AAAS)",
    "article_type": "Policy Forum",
    "title_limit": "Not specified",
    "abstract_limit": "Not specified",
    "word_limit": "2,000–3,000 words",
    "figure_limit": "1–2 figures",
    "reference_limit": "Up to 15 references",
    "structure": "Policy Forums draw on published work to explore issues related to science and society that have policy implications. They synthesise existing research and policy considerations.",
    "other_requirements": "Contributors should ensure a balanced perspective and adhere to Science’s data availability policies. These articles are often commissioned but unsolicited submissions are considered.",
    "last_accessed": "2025-07-26"
  },
  {
    "journal": "Science (AAAS)",
    "article_type": "Book or Media Review",
    "title_limit": "Not specified",
    "abstract_limit": "Not applicable",
    "word_limit": "Up to 800 words",
    "figure_limit": "Not specified",
    "reference_limit": "Not specified",
    "structure": "Book or media reviews provide commentary on new books, films, exhibitions, performances, mobile apps, podcasts or other media likely to interest Science’s readership.",
    "other_requirements": "Unsolicited reviews should explain why the work would interest Science readers and why the author is well‑positioned to write the review. Reviews are subject to editorial acceptance and editing for clarity and length.",
    "last_accessed": "2025-07-26"
  },
  {
    "journal": "Science (AAAS)",
    "article_type": "Letter",
    "title_limit": "Not specified",
    "abstract_limit": "Not applicable",
    "word_limit": "Up to 300 words",
    "figure_limit": "Usually none (embedded images are not allowed for eLetters)",
    "reference_limit": "Not specified (letters usually include minimal or no references)",
    "structure": "Letters discuss material published in Science within the past three months or issues related to recent events. They can be brief personal reflections, critiques or responses to published papers.",
    "other_requirements": "Letters should be submitted via the CTS portal. Authors of papers in question may be given the opportunity to reply. Letters may be edited for clarity and space. eLetters, posted online in response to articles, should not present new data and cannot include embedded images.",
    "last_accessed": "2025-07-26"
  },
  {
    "journal": "Science (AAAS)",
    "article_type": "Editorial or Expert Voice",
    "title_limit": "Not specified",
    "abstract_limit": "Not applicable",
    "word_limit": "Editorials: up to 720 words; Expert Voices: ~1,200 words",
    "figure_limit": "Not specified",
    "reference_limit": "Not specified",
    "structure": "Editorials are signed pieces (up to two authors) expressing compelling opinions on broadly interesting topics. Expert Voices provide conversational discussions on issues in a particular field and appear online only.",
    "other_requirements": "Most Editorials and Expert Voice pieces are solicited by the editors. Authors should adhere to Science’s guidelines on tone, data availability, and referencing.",
    "last_accessed": "2025-07-26"
  },
  {
    "journal": "Experimental & Molecular Medicine (Nature)",
    "article_type": "Research Article",
    "title_limit": "Not specified",
    "abstract_limit": "250 words",
    "word_limit": "6,000 words (excluding abstract, tables, figure legends and references)",
    "figure_limit": "Up to 8 display items (figures or tables)",
    "reference_limit": "60 references",
    "structure": "Manuscripts should follow the order: Title page, Abstract, Introduction, Materials and methods, Results, Discussion, Acknowledgements, Conflict of interest (if applicable), References, Appendices, Figure legends, Tables and Figures. Sections not applicable to a specific article type (e.g., Methods for Reviews) may be omitted【263830740099533†L171-L183】.",